[
  {
    "accountId": "brk_001",
    "apiKeyLast4": "k7Q2",
    "secretSaved": true,
    "plan": "Kite Connect (paid, monthly)",
    "subscriptionRenewsOn": "2026-10-15",
    "redirectUrl": "http://localhost:3001/api/v1/broker/kite/callback",
    "postbackUrl": null,
    "staticIp": null,
    "updatedAt": "2026-09-20T02:30:00Z"
  },
  {
    "accountId": "brk_002",
    "apiKeyLast4": "m3P9",
    "secretSaved": true,
    "plan": "Kite Connect (paid, monthly)",
    "subscriptionRenewsOn": "2026-11-02",
    "redirectUrl": "http://localhost:3001/api/v1/broker/kite/callback",
    "postbackUrl": null,
    "staticIp": "203.0.113.25",
    "updatedAt": "2026-09-18T04:00:00Z"
  },
  {
    "accountId": "brk_003",
    "apiKeyLast4": null,
    "secretSaved": false,
    "plan": null,
    "subscriptionRenewsOn": null,
    "redirectUrl": "http://localhost:3001/api/v1/broker/kite/callback",
    "postbackUrl": null,
    "staticIp": null,
    "updatedAt": null
  }
]
